{
	"slug": "spring-valley",
	"target_type": "location",
	"display_name": "junk car buying in Spring Valley",
	"generated": {
		"by": "bootstrap-research.py",
		"note": "Scaffolded from the existing corpus by bootstrap-research.py. NO EXTERNAL RESEARCH WAS PERFORMED. Every item is marked with the evidence level it actually has; nothing here may be treated as verified until a researcher answers the open questions and records a real source."
	},
	"research_status": {
		"overall": "unresolved",
		"researched_count": 2,
		"verified_count": 1,
		"unresolved_count": 15,
		"unsupported_count": 0,
		"editorial_opportunity_count": 0,
		"blocking_gaps": [
			"q-spring-valley-local-condition",
			"q-spring-valley-00-spring-valley-pickups-usually",
			"q-spring-valley-04-year-make-model-quick",
			"q-spring-valley-06-driver-verifies-vehicle-hands",
			"q-spring-valley-07-handle-title-transfer-all",
			"q-spring-valley-10-whats-minimum-youll-pay"
		]
	},
	"sections": {
		"geographic_context": [
			{
				"id": "spring-valley-is-service-area",
				"statement": "junk car buying in Spring Valley is a configured service area for this business.",
				"why_it_matters": "Establishes that the business serves the area at all.",
				"provenance": {
					"evidence_level": "business_provided",
					"status": "verified",
					"source_type": "official_business",
					"source": "wordpress/themes/<theme>/inc/business-config.php"
				}
			}
		],
		"service_relevance": [
			{
				"id": "spring-valley-existing-coverage",
				"statement": "The existing page covers 407 words across 3 sections.",
				"why_it_matters": "Baseline for judging whether a rewrite adds anything.",
				"provenance": {
					"evidence_level": "research_observation",
					"status": "researched",
					"source_type": "research_observation",
					"source": "content-engine/brief/spring-valley.json"
				}
			}
		],
		"community_context": [
			{
				"id": "spring-valley-named-places",
				"statement": "Places named in existing copy: Desert Breeze Park, Las Vegas, Most Spring Valley, South Durango Drive, South Jones Boulevard, South Rainbow Boulevard, Spring Valley, Spring Valley Spring Valley, West Flamingo Road, West Tropicana Avenue.",
				"why_it_matters": "Place names alone do not differentiate a page; recorded for reference only.",
				"provenance": {
					"evidence_level": "research_observation",
					"status": "researched",
					"source_type": "research_observation",
					"source": "existing page copy"
				}
			}
		]
	},
	"open_questions": [
		{
			"id": "q-spring-valley-local-condition",
			"question": "What local condition in this area materially changes how or why someone sells a junk car, versus elsewhere in the valley?",
			"why": "Without an answer this page has no supported angle and should not be written. A different landmark is not an answer.",
			"suggested_source_type": "official_government",
			"blocks_angle": "spring-valley-primary"
		},
		{
			"id": "q-spring-valley-00-spring-valley-pickups-usually",
			"question": "What authoritative source supports: \"Spring Valley pickups are usually completed the same day — call in the morning, have cash by the afternoon.\"?",
			"why": "Live copy asserts this with no source. Risk: medium.",
			"suggested_source_type": "official_business",
			"blocks_angle": ""
		},
		{
			"id": "q-spring-valley-04-year-make-model-quick",
			"question": "What authoritative source supports: \"Year, make, model, and a quick description of its condition are all we need to give you a firm cash offer.\"?",
			"why": "Live copy asserts this with no source. Risk: medium.",
			"suggested_source_type": "official_business",
			"blocks_angle": ""
		},
		{
			"id": "q-spring-valley-06-driver-verifies-vehicle-hands",
			"question": "What authoritative source supports: \"The driver verifies the vehicle, hands you cash, and loads the car.\"?",
			"why": "Live copy asserts this with no source. Risk: medium.",
			"suggested_source_type": "official_business",
			"blocks_angle": ""
		},
		{
			"id": "q-spring-valley-07-handle-title-transfer-all",
			"question": "What authoritative source supports: \"We handle the title transfer and all DMV paperwork.\"?",
			"why": "Live copy asserts this with no source. Risk: high.",
			"suggested_source_type": "official_government",
			"blocks_angle": ""
		},
		{
			"id": "q-spring-valley-10-whats-minimum-youll-pay",
			"question": "What authoritative source supports: \"What's the minimum you'll pay for a junk car in Spring Valley?\"?",
			"why": "Live copy asserts this with no source. Risk: medium.",
			"suggested_source_type": "official_business",
			"blocks_angle": ""
		},
		{
			"id": "q-spring-valley-12-minimum-offer-typically-around",
			"question": "What authoritative source supports: \"Our minimum offer is typically around $200 for the smallest and most damaged vehicles.\"?",
			"why": "Live copy asserts this with no source. Risk: medium.",
			"suggested_source_type": "official_business",
			"blocks_angle": ""
		},
		{
			"id": "q-spring-valley-13-most-spring-valley-sellers",
			"question": "What authoritative source supports: \"Most Spring Valley sellers receive between $300 and $3,000 depending on the vehicle.\"?",
			"why": "Live copy asserts this with no source. Risk: medium.",
			"suggested_source_type": "official_business",
			"blocks_angle": ""
		}
	],
	"corpus_context": {
		"phase_3b_assessment": "SUPERFICIAL_DIFFERENTIATION",
		"information_gain_verdict": "LOCAL_NAME_SUBSTITUTION_ONLY",
		"rewrite_priority": "REWRITE",
		"closest_sibling": "las-vegas",
		"known_quality_issues": [
			"BELOW_500_WORDS — SEO_STANDARDS.md §6 minimum for a location page",
			"STRUCTURE_MATCHES_SIBLINGS",
			"FAQ_SUBSTANCE_SHARED_WITH_SIBLINGS",
			"SAME_TOPIC_FRAME_AS_SIBLINGS",
			"NO_PAGE_SPECIFIC_CLOSING_CTA"
		]
	}
}
